{
  "schemaVersion": "v2",
  "mode": "privy_execute",
  "lane": "protected",
  "metadata": {
    "source": "terminal-ui",
    "reason": "bounded-perp-order"
  },
  "privyExecute": {
    "wallet": "11111111111111111111111111111111",
    "intent": {
      "family": "perp_order",
      "venueKey": "drift",
      "marketType": "perp",
      "instrumentId": "SOL-PERP",
      "side": "long",
      "quantityAtomic": "1000000",
      "collateralAtomic": "250000"
    },
    "options": {
      "orderType": "limit",
      "limitPriceAtomic": "155000000",
      "reduceOnly": false,
      "timeInForce": "gtc"
    }
  }
}
